{
  "$schema": "https://json-schema.org/draft/2020-12/schema",
  "$id": "https://example.invalid/slopmeter/report.schema.json",
  "title": "Slop Meeter report",
  "type": "object",
  "required": ["schema_version", "tool", "target", "mode", "evidence_score", "slop_level", "confidence", "verdict", "maturity_note", "categories", "checks"],
  "properties": {
    "schema_version": {"const": 1},
    "tool": {
      "type": "object",
      "required": ["name", "version"],
      "properties": {"name": {"const": "slopmeter"}, "version": {"type": "string"}}
    },
    "target": {"type": "string"},
    "mode": {"enum": ["offline", "online"]},
    "evidence_score": {"type": "number", "minimum": 0, "maximum": 100},
    "slop_level": {"type": "integer", "minimum": 0, "maximum": 10},
    "confidence": {"type": "number", "minimum": 0, "maximum": 100},
    "verdict": {"type": "string"},
    "maturity_note": {"type": ["string", "null"]},
    "categories": {"type": "array", "items": {"type": "object"}},
    "checks": {"type": "array", "items": {"type": "object"}}
  },
  "additionalProperties": false
}
